{"pageProps":{"product":"forge","productDocs":{"product":"forge","files":[{"path":"/home/megalith/AtariProjects/AtariFoundry/www/PROJECT_DOCS/forge/cc65/README.md","relativePath":"cc65/README.md","relativeDir":"cc65","filename":"README","slug":"readme","name":"README"},{"path":"/home/megalith/AtariProjects/AtariFoundry/www/PROJECT_DOCS/forge/README.md","relativePath":"README.md","relativeDir":"","filename":"README","slug":"readme","name":"README"},{"path":"/home/megalith/AtariProjects/AtariFoundry/www/PROJECT_DOCS/forge/about/attributions.md","relativePath":"about/attributions.md","relativeDir":"about","filename":"attributions","slug":"attributions","name":"attributions"},{"path":"/home/megalith/AtariProjects/AtariFoundry/www/PROJECT_DOCS/forge/advanced-topics/cio-reference.md","relativePath":"advanced-topics/cio-reference.md","relativeDir":"advanced-topics","filename":"cio-reference","slug":"cio-reference","name":"cio-reference"},{"path":"/home/megalith/AtariProjects/AtariFoundry/www/PROJECT_DOCS/forge/getting-started/compiling.md","relativePath":"getting-started/compiling.md","relativeDir":"getting-started","filename":"compiling","slug":"compiling","name":"compiling"},{"path":"/home/megalith/AtariProjects/AtariFoundry/www/PROJECT_DOCS/forge/getting-started/differences.md","relativePath":"getting-started/differences.md","relativeDir":"getting-started","filename":"differences","slug":"differences","name":"differences"},{"path":"/home/megalith/AtariProjects/AtariFoundry/www/PROJECT_DOCS/forge/advanced-topics/display-list-interrupts.md","relativePath":"advanced-topics/display-list-interrupts.md","relativeDir":"advanced-topics","filename":"display-list-interrupts","slug":"display-list-interrupts","name":"display-list-interrupts"},{"path":"/home/megalith/AtariProjects/AtariFoundry/www/PROJECT_DOCS/forge/editor/editor-guide.md","relativePath":"editor/editor-guide.md","relativeDir":"editor","filename":"editor-guide","slug":"editor-guide","name":"editor-guide"},{"path":"/home/megalith/AtariProjects/AtariFoundry/www/PROJECT_DOCS/forge/editor/editor-optimization.md","relativePath":"editor/editor-optimization.md","relativeDir":"editor","filename":"editor-optimization","slug":"editor-optimization","name":"editor-optimization"},{"path":"/home/megalith/AtariProjects/AtariFoundry/www/PROJECT_DOCS/forge/language-reference/expressions.md","relativePath":"language-reference/expressions.md","relativeDir":"language-reference","filename":"expressions","slug":"expressions","name":"expressions"},{"path":"/home/megalith/AtariProjects/AtariFoundry/www/PROJECT_DOCS/forge/getting-started/first-steps.md","relativePath":"getting-started/first-steps.md","relativeDir":"getting-started","filename":"first-steps","slug":"first-steps","name":"first-steps"},{"path":"/home/megalith/AtariProjects/AtariFoundry/www/PROJECT_DOCS/forge/advanced-topics/fujinet.md","relativePath":"advanced-topics/fujinet.md","relativeDir":"advanced-topics","filename":"fujinet","slug":"fujinet","name":"fujinet"},{"path":"/home/megalith/AtariProjects/AtariFoundry/www/PROJECT_DOCS/forge/language-reference/functions.md","relativePath":"language-reference/functions.md","relativeDir":"language-reference","filename":"functions","slug":"functions","name":"functions"},{"path":"/home/megalith/AtariProjects/AtariFoundry/www/PROJECT_DOCS/forge/reference/hardware-registers.md","relativePath":"reference/hardware-registers.md","relativeDir":"reference","filename":"hardware-registers","slug":"hardware-registers","name":"hardware-registers"},{"path":"/home/megalith/AtariProjects/AtariFoundry/www/PROJECT_DOCS/forge/index.md","relativePath":"index.md","relativeDir":"","filename":"index","slug":"index","name":"index"},{"path":"/home/megalith/AtariProjects/AtariFoundry/www/PROJECT_DOCS/forge/reference/interrupts.md","relativePath":"reference/interrupts.md","relativeDir":"reference","filename":"interrupts","slug":"interrupts","name":"interrupts"},{"path":"/home/megalith/AtariProjects/AtariFoundry/www/PROJECT_DOCS/forge/getting-started/introduction.md","relativePath":"getting-started/introduction.md","relativeDir":"getting-started","filename":"introduction","slug":"introduction","name":"introduction"},{"path":"/home/megalith/AtariProjects/AtariFoundry/www/PROJECT_DOCS/forge/reference/iocb-structure.md","relativePath":"reference/iocb-structure.md","relativeDir":"reference","filename":"iocb-structure","slug":"iocb-structure","name":"iocb-structure"},{"path":"/home/megalith/AtariProjects/AtariFoundry/www/PROJECT_DOCS/forge/advanced-topics/low-level-programming.md","relativePath":"advanced-topics/low-level-programming.md","relativeDir":"advanced-topics","filename":"low-level-programming","slug":"low-level-programming","name":"low-level-programming"},{"path":"/home/megalith/AtariProjects/AtariFoundry/www/PROJECT_DOCS/forge/reference/memory-map.md","relativePath":"reference/memory-map.md","relativeDir":"reference","filename":"memory-map","slug":"memory-map","name":"memory-map"},{"path":"/home/megalith/AtariProjects/AtariFoundry/www/PROJECT_DOCS/forge/reference/memory-usage.md","relativePath":"reference/memory-usage.md","relativeDir":"reference","filename":"memory-usage","slug":"memory-usage","name":"memory-usage"},{"path":"/home/megalith/AtariProjects/AtariFoundry/www/PROJECT_DOCS/forge/advanced-topics/note-point.md","relativePath":"advanced-topics/note-point.md","relativeDir":"advanced-topics","filename":"note-point","slug":"note-point","name":"note-point"},{"path":"/home/megalith/AtariProjects/AtariFoundry/www/PROJECT_DOCS/forge/reference/os-equates.md","relativePath":"reference/os-equates.md","relativeDir":"reference","filename":"os-equates","slug":"os-equates","name":"os-equates"},{"path":"/home/megalith/AtariProjects/AtariFoundry/www/PROJECT_DOCS/forge/reference/r-handler.md","relativePath":"reference/r-handler.md","relativeDir":"reference","filename":"r-handler","slug":"r-handler","name":"r-handler"},{"path":"/home/megalith/AtariProjects/AtariFoundry/www/PROJECT_DOCS/forge/advanced-topics/sio-operations.md","relativePath":"advanced-topics/sio-operations.md","relativeDir":"advanced-topics","filename":"sio-operations","slug":"sio-operations","name":"sio-operations"},{"path":"/home/megalith/AtariProjects/AtariFoundry/www/PROJECT_DOCS/forge/language-reference/statements.md","relativePath":"language-reference/statements.md","relativeDir":"language-reference","filename":"statements","slug":"statements","name":"statements"},{"path":"/home/megalith/AtariProjects/AtariFoundry/www/PROJECT_DOCS/forge/language-reference/syntax.md","relativePath":"language-reference/syntax.md","relativeDir":"language-reference","filename":"syntax","slug":"syntax","name":"syntax"},{"path":"/home/megalith/AtariProjects/AtariFoundry/www/PROJECT_DOCS/forge/about/why-forge.md","relativePath":"about/why-forge.md","relativeDir":"about","filename":"why-forge","slug":"why-forge","name":"why-forge"},{"path":"/home/megalith/AtariProjects/AtariFoundry/www/PROJECT_DOCS/forge/advanced-topics/xio-reference.md","relativePath":"advanced-topics/xio-reference.md","relativeDir":"advanced-topics","filename":"xio-reference","slug":"xio-reference","name":"xio-reference"}],"navTree":{"cc65":{"_files":[{"name":"README","slug":"readme","path":"cc65/README.md","fullPath":"/home/megalith/AtariProjects/AtariFoundry/www/PROJECT_DOCS/forge/cc65/README.md","isIndex":true}]},"_files":[{"name":"README","slug":"readme","path":"README.md","fullPath":"/home/megalith/AtariProjects/AtariFoundry/www/PROJECT_DOCS/forge/README.md","isIndex":true},{"name":"index","slug":"index","path":"index.md","fullPath":"/home/megalith/AtariProjects/AtariFoundry/www/PROJECT_DOCS/forge/index.md","isIndex":false}],"about":{"_files":[{"name":"attributions","slug":"attributions","path":"about/attributions.md","fullPath":"/home/megalith/AtariProjects/AtariFoundry/www/PROJECT_DOCS/forge/about/attributions.md","isIndex":false},{"name":"why-forge","slug":"why-forge","path":"about/why-forge.md","fullPath":"/home/megalith/AtariProjects/AtariFoundry/www/PROJECT_DOCS/forge/about/why-forge.md","isIndex":false}]},"advanced-topics":{"_files":[{"name":"cio-reference","slug":"cio-reference","path":"advanced-topics/cio-reference.md","fullPath":"/home/megalith/AtariProjects/AtariFoundry/www/PROJECT_DOCS/forge/advanced-topics/cio-reference.md","isIndex":false},{"name":"display-list-interrupts","slug":"display-list-interrupts","path":"advanced-topics/display-list-interrupts.md","fullPath":"/home/megalith/AtariProjects/AtariFoundry/www/PROJECT_DOCS/forge/advanced-topics/display-list-interrupts.md","isIndex":false},{"name":"fujinet","slug":"fujinet","path":"advanced-topics/fujinet.md","fullPath":"/home/megalith/AtariProjects/AtariFoundry/www/PROJECT_DOCS/forge/advanced-topics/fujinet.md","isIndex":false},{"name":"low-level-programming","slug":"low-level-programming","path":"advanced-topics/low-level-programming.md","fullPath":"/home/megalith/AtariProjects/AtariFoundry/www/PROJECT_DOCS/forge/advanced-topics/low-level-programming.md","isIndex":false},{"name":"note-point","slug":"note-point","path":"advanced-topics/note-point.md","fullPath":"/home/megalith/AtariProjects/AtariFoundry/www/PROJECT_DOCS/forge/advanced-topics/note-point.md","isIndex":false},{"name":"sio-operations","slug":"sio-operations","path":"advanced-topics/sio-operations.md","fullPath":"/home/megalith/AtariProjects/AtariFoundry/www/PROJECT_DOCS/forge/advanced-topics/sio-operations.md","isIndex":false},{"name":"xio-reference","slug":"xio-reference","path":"advanced-topics/xio-reference.md","fullPath":"/home/megalith/AtariProjects/AtariFoundry/www/PROJECT_DOCS/forge/advanced-topics/xio-reference.md","isIndex":false}]},"getting-started":{"_files":[{"name":"compiling","slug":"compiling","path":"getting-started/compiling.md","fullPath":"/home/megalith/AtariProjects/AtariFoundry/www/PROJECT_DOCS/forge/getting-started/compiling.md","isIndex":false},{"name":"differences","slug":"differences","path":"getting-started/differences.md","fullPath":"/home/megalith/AtariProjects/AtariFoundry/www/PROJECT_DOCS/forge/getting-started/differences.md","isIndex":false},{"name":"first-steps","slug":"first-steps","path":"getting-started/first-steps.md","fullPath":"/home/megalith/AtariProjects/AtariFoundry/www/PROJECT_DOCS/forge/getting-started/first-steps.md","isIndex":false},{"name":"introduction","slug":"introduction","path":"getting-started/introduction.md","fullPath":"/home/megalith/AtariProjects/AtariFoundry/www/PROJECT_DOCS/forge/getting-started/introduction.md","isIndex":false}]},"editor":{"_files":[{"name":"editor-guide","slug":"editor-guide","path":"editor/editor-guide.md","fullPath":"/home/megalith/AtariProjects/AtariFoundry/www/PROJECT_DOCS/forge/editor/editor-guide.md","isIndex":false},{"name":"editor-optimization","slug":"editor-optimization","path":"editor/editor-optimization.md","fullPath":"/home/megalith/AtariProjects/AtariFoundry/www/PROJECT_DOCS/forge/editor/editor-optimization.md","isIndex":false}]},"language-reference":{"_files":[{"name":"expressions","slug":"expressions","path":"language-reference/expressions.md","fullPath":"/home/megalith/AtariProjects/AtariFoundry/www/PROJECT_DOCS/forge/language-reference/expressions.md","isIndex":false},{"name":"functions","slug":"functions","path":"language-reference/functions.md","fullPath":"/home/megalith/AtariProjects/AtariFoundry/www/PROJECT_DOCS/forge/language-reference/functions.md","isIndex":false},{"name":"statements","slug":"statements","path":"language-reference/statements.md","fullPath":"/home/megalith/AtariProjects/AtariFoundry/www/PROJECT_DOCS/forge/language-reference/statements.md","isIndex":false},{"name":"syntax","slug":"syntax","path":"language-reference/syntax.md","fullPath":"/home/megalith/AtariProjects/AtariFoundry/www/PROJECT_DOCS/forge/language-reference/syntax.md","isIndex":false}]},"reference":{"_files":[{"name":"hardware-registers","slug":"hardware-registers","path":"reference/hardware-registers.md","fullPath":"/home/megalith/AtariProjects/AtariFoundry/www/PROJECT_DOCS/forge/reference/hardware-registers.md","isIndex":false},{"name":"interrupts","slug":"interrupts","path":"reference/interrupts.md","fullPath":"/home/megalith/AtariProjects/AtariFoundry/www/PROJECT_DOCS/forge/reference/interrupts.md","isIndex":false},{"name":"iocb-structure","slug":"iocb-structure","path":"reference/iocb-structure.md","fullPath":"/home/megalith/AtariProjects/AtariFoundry/www/PROJECT_DOCS/forge/reference/iocb-structure.md","isIndex":false},{"name":"memory-map","slug":"memory-map","path":"reference/memory-map.md","fullPath":"/home/megalith/AtariProjects/AtariFoundry/www/PROJECT_DOCS/forge/reference/memory-map.md","isIndex":false},{"name":"memory-usage","slug":"memory-usage","path":"reference/memory-usage.md","fullPath":"/home/megalith/AtariProjects/AtariFoundry/www/PROJECT_DOCS/forge/reference/memory-usage.md","isIndex":false},{"name":"os-equates","slug":"os-equates","path":"reference/os-equates.md","fullPath":"/home/megalith/AtariProjects/AtariFoundry/www/PROJECT_DOCS/forge/reference/os-equates.md","isIndex":false},{"name":"r-handler","slug":"r-handler","path":"reference/r-handler.md","fullPath":"/home/megalith/AtariProjects/AtariFoundry/www/PROJECT_DOCS/forge/reference/r-handler.md","isIndex":false}]}}},"docFile":{"path":"/home/megalith/AtariProjects/AtariFoundry/www/PROJECT_DOCS/forge/index.md","relativePath":"index.md","relativeDir":"","filename":"index","slug":"index","name":"index","content":"# FORGE Documentation - Table of Contents\n\nComplete index of all FORGE documentation pages.\n\n## Getting Started\n\n### [Introduction](getting-started/introduction.md)\nOverview of FORGE, its features, and how it differs from other BASIC interpreters.\n\n### [First Steps](getting-started/first-steps.md)\nTutorial for writing your first FORGE program, including:\n- Starting the IDE\n- Basic program structure\n- Running programs\n- Common mistakes and troubleshooting\n\n### [Compiling](getting-started/compiling.md)\nGuide to compiling FORGE programs:\n- Compiling from the IDE\n- Command-line compiler usage\n- File size considerations\n- Integer vs floating point versions\n\n### [FORGE Features](getting-started/differences.md)\nComplete guide to FORGE features:\n- Key statements (FUNC, STATUS, NOTE, POINT, INCLUDE)\n- New functions (DVSTAT)\n- Functional enhancements\n- Language capabilities\n\n## Editor\n\n### [Editor Guide](editor/editor-guide.md)\nComplete reference for the FORGE integrated editor:\n- Keyboard shortcuts\n- Navigation commands\n- File operations\n- Copy/paste operations\n- Workflow tips\n\n### [Editor Optimization](editor/editor-optimization.md)\nPerformance tips for the editor:\n- Using EFAST screen accelerator\n- 80-column support\n- Performance optimization\n\n## Language Reference\n\n### [Syntax](language-reference/syntax.md)\nLanguage syntax rules and conventions:\n- Line types (comments, statements, assignments)\n- Case insensitivity\n- Statement abbreviations\n- Multiple statements per line\n- Comments\n\n### [Expressions](language-reference/expressions.md)\nComplete guide to expressions:\n- Numeric expressions (integer and floating point)\n- Boolean expressions\n- String expressions\n- Operators and precedence\n- Type conversion\n- Arrays\n- String operations\n\n### [Functions](language-reference/functions.md)\nAll available functions organized by category:\n- **Standard Functions**: TIME, ABS, SGN, RAND, FRE, ERR, LEN, VAL, ASC\n- **Atari-Specific Functions**: PADDLE, PMADR, PTRIG, STICK, STRIG, KEY\n- **R: Device Status Functions**: Functions for serial device status\n- **Floating Point Functions**: ATN, COS, EXP, EXP10, INT, LOG, LOG10, RND, SIN, SQR, %TIME\n- **String Functions**: STR$, CHR$\n- **Low-Level Functions**: ADR, DPEEK, DVSTAT, PEEK, USR, $(), %()\n\n### [Statements](language-reference/statements.md)\nAll available statements organized by category:\n- **Console I/O**: GET, INPUT, POSITION, PRINT, PUT, CLS\n- **Control Flow**: DO/LOOP, EXEC, EXIT, FOR/NEXT, IF/ELSE/ENDIF, FUNC/ENDFUNC, INCLUDE, REPEAT/UNTIL, WHILE/WEND\n- **Graphics & Sound**: COLOR, DRAWTO, FCOLOR, FILLTO, GRAPHICS, LOCATE, PLOT, PMGRAPHICS, PMHPOS, SETCOLOR, SOUND\n- **Device I/O**: BGET, BPUT, CLOSE, GET #, INPUT #, OPEN, PRINT #, PUT #, NOTE, POINT, STATUS, XIO\n- **General**: Comments, CLR, DATA, DEC, DIM, END, INC, PAUSE, TIMER\n- **Floating Point**: DEG, RAD\n- **Low-Level**: DPOKE, MOVE, -MOVE, MSET, POKE\n\n## Advanced Topics\n\n### [Display List Interrupts](advanced-topics/display-list-interrupts.md)\nGuide to DLI programming:\n- What are DLIs\n- Defining DLIs\n- Enabling/disabling DLIs\n- Register reference\n- Examples\n\n### [SIO Operations](advanced-topics/sio-operations.md)\nSerial Input/Output interface:\n- SIO statement\n- SERR() function\n- Device communication\n- Error handling\n\n### [FujiNet](advanced-topics/fujinet.md)\nNetwork programming with FujiNet:\n- NOPEN - Opening connections\n- NCLOSE - Closing connections\n- NSTATUS - Connection status\n- NGET/NPUT - Reading/writing data\n- Protocol support\n\n### [CIO Reference](advanced-topics/cio-reference.md)\nCentral Input/Output utility reference:\n- CIO channels\n- IOCB structure\n- CIO commands\n- Channel usage\n- Examples\n\n### [XIO Reference](advanced-topics/xio-reference.md)\nExtended I/O command codes:\n- Complete XIO command list\n- Usage examples\n- Common operations\n- Device-specific commands\n\n### [Low-Level Programming](advanced-topics/low-level-programming.md)\nMemory operations and hardware access:\n- POKE/PEEK operations\n- Memory manipulation\n- Safety warnings\n- Common patterns\n- Memory map references\n\n### [NOTE/POINT](advanced-topics/note-point.md)\nFile positioning operations:\n- NOTE statement - Get file position\n- POINT statement - Set file position\n- Random access file operations\n- Examples and use cases\n- AUX1 preservation behavior\n\n## Reference\n\n### [Memory Map](reference/memory-map.md)\nComplete Atari memory map:\n- Page 0 (Zero Page)\n- Page 1 (Stack)\n- Pages 2-5 (OS Database)\n- Page 6 (User Space)\n- Hardware registers\n- ROM addresses\n\n### [Hardware Registers](reference/hardware-registers.md)\nHardware register reference:\n- GTIA registers\n- POKEY registers\n- ANTIC registers\n- PIA registers\n- Shadow registers\n\n### [OS Equates](reference/os-equates.md)\nOperating system constants:\n- Status codes\n- Device names\n- Vector addresses\n- Error codes\n- System variables\n\n### [Memory Usage](reference/memory-usage.md)\nMemory usage guidelines:\n- Page organization\n- BASIC/FP usage\n- Safe memory usage\n- Page 6 information\n\n### [Interrupts](reference/interrupts.md)\nSystem interrupt documentation:\n- Interrupt types\n- Vector addresses\n- DLI/VBI information\n- Interrupt handling\n\n### [IOCB Structure](reference/iocb-structure.md)\nInput/Output Control Block reference:\n- IOCB byte layout\n- Channel addressing\n- Status code interpretation\n- Practical examples\n\n### [R: Handler](reference/r-handler.md)\nR: device handler reference:\n- Serial port configuration\n- XIO commands for R: devices\n- Networking examples\n- Device-specific features\n\n## About FORGE\n\n### [Why FORGE?](about/why-forge.md)\nThe story behind FORGE:\n- Why FORGE was created\n- Project goals and vision\n- Development philosophy\n\n### [Attributions](about/attributions.md)\nCredits and copyright information:\n- License information\n- Copyright notices\n- Source attribution"},"currentPath":"index"},"__N_SSG":true}