{"pageProps":{"product":"crucible","productDocs":{"product":"crucible","files":[{"path":"/home/megalith/AtariProjects/AtariFoundry/www/PROJECT_DOCS/crucible/README.md","relativePath":"README.md","relativeDir":"","filename":"README","slug":"readme","name":"README"},{"path":"/home/megalith/AtariProjects/AtariFoundry/www/PROJECT_DOCS/crucible/API_REFERENCE.md","relativePath":"API_REFERENCE.md","relativeDir":"","filename":"API_REFERENCE","slug":"api-reference","name":"API REFERENCE"},{"path":"/home/megalith/AtariProjects/AtariFoundry/www/PROJECT_DOCS/crucible/ARCHITECTURE.md","relativePath":"ARCHITECTURE.md","relativeDir":"","filename":"ARCHITECTURE","slug":"architecture","name":"ARCHITECTURE"},{"path":"/home/megalith/AtariProjects/AtariFoundry/www/PROJECT_DOCS/crucible/ATTRIBUTIONS.md","relativePath":"ATTRIBUTIONS.md","relativeDir":"","filename":"ATTRIBUTIONS","slug":"attributions","name":"ATTRIBUTIONS"},{"path":"/home/megalith/AtariProjects/AtariFoundry/www/PROJECT_DOCS/crucible/BUILDING.md","relativePath":"BUILDING.md","relativeDir":"","filename":"BUILDING","slug":"building","name":"BUILDING"},{"path":"/home/megalith/AtariProjects/AtariFoundry/www/PROJECT_DOCS/crucible/CHANGELOG.md","relativePath":"CHANGELOG.md","relativeDir":"","filename":"CHANGELOG","slug":"changelog","name":"CHANGELOG"},{"path":"/home/megalith/AtariProjects/AtariFoundry/www/PROJECT_DOCS/crucible/USER_GUIDE.md","relativePath":"USER_GUIDE.md","relativeDir":"","filename":"USER_GUIDE","slug":"user-guide","name":"USER GUIDE"}],"navTree":{"_files":[{"name":"README","slug":"readme","path":"README.md","fullPath":"/home/megalith/AtariProjects/AtariFoundry/www/PROJECT_DOCS/crucible/README.md","isIndex":true},{"name":"API REFERENCE","slug":"api-reference","path":"API_REFERENCE.md","fullPath":"/home/megalith/AtariProjects/AtariFoundry/www/PROJECT_DOCS/crucible/API_REFERENCE.md","isIndex":false},{"name":"ARCHITECTURE","slug":"architecture","path":"ARCHITECTURE.md","fullPath":"/home/megalith/AtariProjects/AtariFoundry/www/PROJECT_DOCS/crucible/ARCHITECTURE.md","isIndex":false},{"name":"ATTRIBUTIONS","slug":"attributions","path":"ATTRIBUTIONS.md","fullPath":"/home/megalith/AtariProjects/AtariFoundry/www/PROJECT_DOCS/crucible/ATTRIBUTIONS.md","isIndex":false},{"name":"BUILDING","slug":"building","path":"BUILDING.md","fullPath":"/home/megalith/AtariProjects/AtariFoundry/www/PROJECT_DOCS/crucible/BUILDING.md","isIndex":false},{"name":"CHANGELOG","slug":"changelog","path":"CHANGELOG.md","fullPath":"/home/megalith/AtariProjects/AtariFoundry/www/PROJECT_DOCS/crucible/CHANGELOG.md","isIndex":false},{"name":"USER GUIDE","slug":"user-guide","path":"USER_GUIDE.md","fullPath":"/home/megalith/AtariProjects/AtariFoundry/www/PROJECT_DOCS/crucible/USER_GUIDE.md","isIndex":false}]}},"docFile":{"path":"/home/megalith/AtariProjects/AtariFoundry/www/PROJECT_DOCS/crucible/README.md","relativePath":"README.md","relativeDir":"","filename":"README","slug":"readme","name":"README","content":"# Crucible Documentation\n\nWelcome to the crucible documentation. This directory contains comprehensive documentation for the crucible 6502 simulator with Atari 8-bit BIOS emulation.\n\n## Documentation Index\n\n### User Documentation\n\n- **[User Guide](USER_GUIDE.md)** - Complete user guide with examples\n  - Installation instructions\n  - Command-line options\n  - Device support\n  - File formats\n  - Troubleshooting\n\n### Developer Documentation\n\n- **[Architecture](ARCHITECTURE.md)** - Technical architecture and design\n  - System architecture overview\n  - Core components\n  - Memory map\n  - Device handlers\n  - Filesystem implementation\n  - Hardware emulation\n  - Callback system\n\n- **[API Reference](API_REFERENCE.md)** - Complete API documentation\n  - Core simulator API\n  - Atari BIOS API\n  - ATR filesystem API\n  - Host filesystem API\n  - SIO API\n  - Data structures\n  - Code examples\n\n- **[Building Guide](BUILDING.md)** - Build system documentation\n  - Prerequisites\n  - Build options\n  - Platform-specific instructions\n  - Troubleshooting\n  - Advanced configuration\n\n### Project Information\n\n- **[Changelog](CHANGELOG.md)** - Version history and changes\n- **[Attributions](ATTRIBUTIONS.md)** - Credits and attributions\n\n## Quick Start\n\n1. **Build the project**:\n   ```bash\n   make\n   ```\n\n2. **Run a program**:\n   ```bash\n   ./build/crucible program.xex\n   ```\n\n3. **Get help**:\n   ```bash\n   ./build/crucible -h\n   ```\n\n## Documentation Structure\n\n```\ndocs/\n├── README.md           # This file\n├── USER_GUIDE.md       # User documentation\n├── ARCHITECTURE.md     # Technical architecture\n├── API_REFERENCE.md    # API documentation\n├── BUILDING.md         # Build instructions\n├── CHANGELOG.md        # Version history\n└── ATTRIBUTIONS.md     # Credits\n```\n\n## Getting Help\n\n- **User Questions**: See [User Guide](USER_GUIDE.md)\n- **Development Questions**: See [API Reference](API_REFERENCE.md)\n- **Build Issues**: See [Building Guide](BUILDING.md)\n- **Architecture Questions**: See [Architecture](ARCHITECTURE.md)\n\n## Contributing\n\nWhen contributing to crucible:\n\n1. Read the [Architecture](ARCHITECTURE.md) documentation\n2. Follow the coding style\n3. Update [CHANGELOG.md](CHANGELOG.md) with changes\n4. Update [ATTRIBUTIONS.md](ATTRIBUTIONS.md) if needed\n5. Update relevant documentation\n\n## License\n\nSee the main LICENSE file in the project root. All documentation is provided under the same license as the project (GPL v2 or later).\n"},"currentPath":""},"__N_SSG":true}